{
  "version": 1,
  "scannerVersion": "1.1.0",
  "generatedAt": "2026-06-08T13:39:06.449Z",
  "root": "/Users/vcsm/Desktop/VCSM",
  "scanDurationMs": 6492,
  "confidence": "HIGH",
  "routeCount": 243,
  "data": {
    "version": 1,
    "generatedAt": "2026-06-08T13:39:02.615Z",
    "routes": [
      {
        "route": "/",
        "routeType": "static",
        "access": "public",
        "routeAccess": "public",
        "runtime": "web",
        "elementName": null,
        "source": "route-object",
        "confidence": "HIGH",
        "evidence": [
          "route extracted from AST"
        ],
        "type": "static",
        "app": "Traffic",
        "appId": "Traffic",
        "root": "apps/Traffic",
        "feature": null,
        "path": "apps/Traffic/src/app/page.jsx",
        "file": "apps/Traffic/src/app/page.jsx"
      },
      {
        "route": "/[city]",
        "type": "dynamic",
        "routeType": "dynamic",
        "access": "public",
        "routeAccess": "public",
        "runtime": "web",
        "confidence": "HIGH",
        "evidence": [
          "Next app-router page or route file exists"
        ],
        "app": "Traffic",
        "appId": "Traffic",
        "root": "apps/Traffic",
        "feature": "app",
        "path": "apps/Traffic/src/app/(seo)/[city]/page.jsx",
        "file": "apps/Traffic/src/app/(seo)/[city]/page.jsx",
        "source": "next-app-router"
      },
      {
        "route": "/[city]/[segment]",
        "type": "dynamic",
        "routeType": "dynamic",
        "access": "public",
        "routeAccess": "public",
        "runtime": "web",
        "confidence": "HIGH",
        "evidence": [
          "Next app-router page or route file exists"
        ],
        "app": "Traffic",
        "appId": "Traffic",
        "root": "apps/Traffic",
        "feature": "app",
        "path": "apps/Traffic/src/app/(seo)/[city]/[segment]/page.jsx",
        "file": "apps/Traffic/src/app/(seo)/[city]/[segment]/page.jsx",
        "source": "next-app-router"
      },
      {
        "route": "/[city]/[segment]/[service]",
        "type": "dynamic",
        "routeType": "dynamic",
        "access": "public",
        "routeAccess": "public",
        "runtime": "web",
        "confidence": "HIGH",
        "evidence": [
          "Next app-router page or route file exists"
        ],
        "app": "Traffic",
        "appId": "Traffic",
        "root": "apps/Traffic",
        "feature": "app",
        "path": "apps/Traffic/src/app/(seo)/[city]/[segment]/[service]/page.jsx",
        "file": "apps/Traffic/src/app/(seo)/[city]/[segment]/[service]/page.jsx",
        "source": "next-app-router"
      },
      {
        "route": "/[city]/[segment]/[service]/[detail]",
        "type": "dynamic",
        "routeType": "dynamic",
        "access": "public",
        "routeAccess": "public",
        "runtime": "web",
        "confidence": "HIGH",
        "evidence": [
          "Next app-router page or route file exists"
        ],
        "app": "Traffic",
        "appId": "Traffic",
        "root": "apps/Traffic",
        "feature": "app",
        "path": "apps/Traffic/src/app/(seo)/[city]/[segment]/[service]/[detail]/page.jsx",
        "file": "apps/Traffic/src/app/(seo)/[city]/[segment]/[service]/[detail]/page.jsx",
        "source": "next-app-router"
      },
      {
        "route": "/[city]/[segment]/[service]/[detail]/[specialty]",
        "type": "dynamic",
        "routeType": "dynamic",
        "access": "public",
        "routeAccess": "public",
        "runtime": "web",
        "confidence": "HIGH",
        "evidence": [
          "Next app-router page or route file exists"
        ],
        "app": "Traffic",
        "appId": "Traffic",
        "root": "apps/Traffic",
        "feature": "app",
        "path": "apps/Traffic/src/app/(seo)/[city]/[segment]/[service]/[detail]/[specialty]/page.jsx",
        "file": "apps/Traffic/src/app/(seo)/[city]/[segment]/[service]/[detail]/[specialty]/page.jsx",
        "source": "next-app-router"
      },
      {
        "route": "/[city]/categories",
        "type": "dynamic",
        "routeType": "dynamic",
        "access": "public",
        "routeAccess": "public",
        "runtime": "web",
        "confidence": "HIGH",
        "evidence": [
          "Next app-router page or route file exists"
        ],
        "app": "Traffic",
        "appId": "Traffic",
        "root": "apps/Traffic",
        "feature": "app",
        "path": "apps/Traffic/src/app/(seo)/[city]/categories/page.jsx",
        "file": "apps/Traffic/src/app/(seo)/[city]/categories/page.jsx",
        "source": "next-app-router"
      },
      {
        "route": "/[city]/pro/[providerSlug]",
        "type": "dynamic",
        "routeType": "dynamic",
        "access": "public",
        "routeAccess": "public",
        "runtime": "web",
        "confidence": "HIGH",
        "evidence": [
          "Next app-router page or route file exists"
        ],
        "app": "Traffic",
        "appId": "Traffic",
        "root": "apps/Traffic",
        "feature": "app",
        "path": "apps/Traffic/src/app/(seo)/[city]/pro/[providerSlug]/page.jsx",
        "file": "apps/Traffic/src/app/(seo)/[city]/pro/[providerSlug]/page.jsx",
        "source": "next-app-router"
      },
      {
        "route": "/[city]/top-providers",
        "type": "dynamic",
        "routeType": "dynamic",
        "access": "public",
        "routeAccess": "public",
        "runtime": "web",
        "confidence": "HIGH",
        "evidence": [
          "Next app-router page or route file exists"
        ],
        "app": "Traffic",
        "appId": "Traffic",
        "root": "apps/Traffic",
        "feature": "app",
        "path": "apps/Traffic/src/app/(seo)/[city]/top-providers/page.jsx",
        "file": "apps/Traffic/src/app/(seo)/[city]/top-providers/page.jsx",
        "source": "next-app-router"
      },
      {
        "route": "/answers",
        "routeType": "static",
        "access": "public",
        "routeAccess": "public",
        "runtime": "web",
        "elementName": null,
        "source": "route-object",
        "confidence": "HIGH",
        "evidence": [
          "route extracted from AST"
        ],
        "type": "static",
        "app": "Traffic",
        "appId": "Traffic",
        "root": "apps/Traffic",
        "feature": null,
        "path": "apps/Traffic/src/app/answers/page.jsx",
        "file": "apps/Traffic/src/app/answers/page.jsx"
      },
      {
        "route": "/answers/[slug]",
        "type": "dynamic",
        "routeType": "dynamic",
        "access": "public",
        "routeAccess": "public",
        "runtime": "web",
        "confidence": "HIGH",
        "evidence": [
          "Next app-router page or route file exists"
        ],
        "app": "Traffic",
        "appId": "Traffic",
        "root": "apps/Traffic",
        "feature": "app",
        "path": "apps/Traffic/src/app/answers/[slug]/page.jsx",
        "file": "apps/Traffic/src/app/answers/[slug]/page.jsx",
        "source": "next-app-router"
      },
      {
        "route": "/answers/moderation",
        "type": "static",
        "routeType": "static",
        "access": "public",
        "routeAccess": "public",
        "runtime": "web",
        "confidence": "HIGH",
        "evidence": [
          "Next app-router page or route file exists"
        ],
        "app": "Traffic",
        "appId": "Traffic",
        "root": "apps/Traffic",
        "feature": "app",
        "path": "apps/Traffic/src/app/answers/moderation/page.jsx",
        "file": "apps/Traffic/src/app/answers/moderation/page.jsx",
        "source": "next-app-router"
      },
      {
        "route": "/api/answers/moderation/answers",
        "type": "static",
        "routeType": "static",
        "access": "public",
        "routeAccess": "public",
        "runtime": "web",
        "confidence": "HIGH",
        "evidence": [
          "Next app-router page or route file exists"
        ],
        "app": "Traffic",
        "appId": "Traffic",
        "root": "apps/Traffic",
        "feature": "app",
        "path": "apps/Traffic/src/app/api/answers/moderation/answers/route.js",
        "file": "apps/Traffic/src/app/api/answers/moderation/answers/route.js",
        "source": "next-app-router"
      },
      {
        "route": "/api/answers/moderation/questions",
        "type": "static",
        "routeType": "static",
        "access": "public",
        "routeAccess": "public",
        "runtime": "web",
        "confidence": "HIGH",
        "evidence": [
          "Next app-router page or route file exists"
        ],
        "app": "Traffic",
        "appId": "Traffic",
        "root": "apps/Traffic",
        "feature": "app",
        "path": "apps/Traffic/src/app/api/answers/moderation/questions/route.js",
        "file": "apps/Traffic/src/app/api/answers/moderation/questions/route.js",
        "source": "next-app-router"
      },
      {
        "route": "/api/answers/questions",
        "type": "static",
        "routeType": "static",
        "access": "public",
        "routeAccess": "public",
        "runtime": "web",
        "confidence": "HIGH",
        "evidence": [
          "Next app-router page or route file exists"
        ],
        "app": "Traffic",
        "appId": "Traffic",
        "root": "apps/Traffic",
        "feature": "app",
        "path": "apps/Traffic/src/app/api/answers/questions/route.js",
        "file": "apps/Traffic/src/app/api/answers/questions/route.js",
        "source": "next-app-router"
      },
      {
        "route": "/categories",
        "routeType": "static",
        "access": "public",
        "routeAccess": "public",
        "runtime": "web",
        "elementName": null,
        "source": "route-object",
        "confidence": "HIGH",
        "evidence": [
          "route extracted from AST"
        ],
        "type": "static",
        "app": "Traffic",
        "appId": "Traffic",